{
  "as_of": "2026-07-23",
  "auto_actions": [],
  "boundaries": {
    "adk_modified": false,
    "article_body_persisted": false,
    "credentials_persisted": false,
    "decision_generated": false,
    "external_code_executed": false,
    "live_runtime_modified": false,
    "network_write": false,
    "repository_modified": false
  },
  "candidate_count": 1,
  "deduplicated_count": 0,
  "jobs": [
    {
      "candidate_count": 1,
      "deduplicated_count": 0,
      "duration_ms": 831,
      "error_code": null,
      "id": "github-collect",
      "input_ref": null,
      "input_sha256": null,
      "mode": "live",
      "provider": "github",
      "rate_limit": {},
      "request": {
        "host": "api.github.com",
        "path": "/search/repositories",
        "query_sha256": "496e00db5321f946"
      },
      "status": "complete",
      "transport": "metadata-only"
    }
  ],
  "ledger_sha256": "6653e7fffd0769866dcd254c3f7ca191ade64b207a78114de6c24dfd680f6e7c",
  "mode": "report-only",
  "schema": "external-practice-cycle-evidence/v1",
  "status": "complete"
}
